video_id,title,publishedAt,channelId,channelTitle,categoryId,trending_date,tags,view_count,likes,dislikes,comment_count,thumbnail_link,comments_disabled,ratings_disabled,description
"ms8FWnpaeS8","밀키복이탄이가 떠납니다...","2021-03-31T10:00:18Z","UCP1CQH2PVJv4-glNTuVJl3g","밀키복이탄이MilkyBokiTan","15","21.02.04","강아지|고양이|puppy|cat|Anak anjing|Kucing|पिल्ला|बिल्ली|사모예드|dog|köpek yavrusu|kedi","573277","38338","377","5201","https://i.ytimg.com/vi/ms8FWnpaeS8/default.jpg","False","False","#MilkyBokiTan#밀키복이탄이시청해주셔서 감사합니다!-번역 / subs영어 / English : Sarah Lee스페인어 / Spanish : amigo coreano러시아어 / Russian : Surgey Urazov중국어(Chinese), 인도네시아어(Indonesian) : Monica Christina일본어 / Japanese : Yuri태국어 / Thai : Nart Piengpaj터키어 / Turkish : Wildcard.13▶ Profile묘종 : 노르웨이 숲 고양이이름 : 광복이성별 : 수컷생년월일 : 2018.08.15 ▶ Profile견종 : 사모예드 이름 : 밀키성별 : 수컷생년월일 : 2018.12.03▶ Profile묘종 : 길고양이(유기동물 보호소 구조묘, 코리안 숏헤어) 이름 : 탄이성별 : 수컷생년월일 : 2020년 4월 말 추정▶ ProfileName :  Gwang BokType : Norwegian ForestSex : maleBirth : 15.08.2018▶ ProfileName : MilkyType :  SamoyedSex : maleBirth :  03.12.2018▶ ProfileName : TanType :  Ginger Domestic Shorthair/TabbySex : maleBirth :  Late April, 2020(estimate)"
"cu_Nh6C_WOg","무랑 싸웠다","2021-03-30T11:07:07Z","UCOp66Vup07X0YziXaaxqs2A","haha ha","15","21.02.04","하하하|hahaha|haha ha|하하 하|고양이|무|cat|Mu","586229","27354","96","3390","https://i.ytimg.com/vi/cu_Nh6C_WOg/default.jpg","False","False",""
"CNlHj1Gc6t4","1억 2천짜리 몰카","2021-03-31T10:00:11Z","UCjGoJbTmFYjd5OnPRUur02A","김강민_Kim Kang min","24","21.02.04","김강민|monday5pm|송아름|bmw|bmw x6|x6","379334","5078","174","656","https://i.ytimg.com/vi/CNlHj1Gc6t4/default.jpg","False","False","#김강민 #송아름 #bmw x6영상 및 광고 문의: monday5pm.yt@gmail.com인스타그램: https://www.instagram.com/kang_min_kim/"
"n0eoCi5zrZw","저는 물을 마시면 죽는 병이 있어요! 🐈 꼬냥툰ㅣ영상툰ㅣ썰툰ㅣ사연툰ㅣ고민툰","2021-03-29T08:30:16Z","UC6q6s67CerzPYPRl7NIRfcA","꼬냥툰","1","21.02.04","고민툰|사연툰|썰툰|사이다툰|영상툰|animation|animations|Cartoon|korean animation|comics|animate|videotoons|video toon|코로나|좀비|물알레르기|알레르기|물","313201","4377","244","1066","https://i.ytimg.com/vi/n0eoCi5zrZw/default.jpg","False","False","[꼬냥툰🐈] 저는 물을 마시면 죽는 병이 있어요! 👇 꼬냥툰 구독하기 클릭! 👇https://bit.ly/3bMUAo5--------------------------------------------------------------------사이다, 고민,사연 등 이야기를 보내주세요~추첨후 영상으로 제작해드려요~ ㅇㅅㅇv👇 꼬냥툰 이야기 보내기 클릭! 👇https://forms.gle/rzWEXs3amJfupKXk7--------------------------------------------------------------------#고민툰 #사연툰 #썰툰 #영상툰"
"uOqiXNPsDO4","[몰카] 엄마 방에서 아들과 낯선여자가 뒹굴고 있는 현장을 본다면? 10년 만에 회초리든 엄마!! ㅋㅋㅋㅋ가짜다리 몰카 2탄","2021-03-30T08:00:14Z","UCEUL40nXJFCBv9z3Q1V6YMQ","면상들","23","21.02.04","면상들|몰카|피식대학|핫소스|폭소바겐|욜로코믹스|시트콤|웃긴영상|꿀잼|prank|스타킹","269223","4412","139","569","https://i.ytimg.com/vi/uOqiXNPsDO4/default.jpg","False","False","#면상들 #다리 #몰카"
"AYYbpfjSOaI","[몰카]5억당첨복권 사정없이 찢어보자ㅋㅋㅋㅋ","2021-03-30T08:00:03Z","UCKkxVSUMRvmvAXMNzjI03Ag","배꼽빌라","22","21.02.04","배꼽빌라|복권몰카|몰카|몰래카메라|웃긴영상|미녀몰카","290320","3443","166","337","https://i.ytimg.com/vi/AYYbpfjSOaI/default.jpg","False","False","#배꼽빌라#몰카#몰래카메라.띵동띵동~ㅋㅋㅋㅋ만들어논 복권이 남아서 예림이한테도저질러버렸습니다ㅋㅋㅋ재미있게 봐주세용ㅋ"
"GPRQGD2X9rg","다들 출산엔 관심이 많지만 그 이후가 사실 더 어렵다지. 자연분만 회복🔥","2021-03-28T06:38:22Z","UCkh6TlSape86-iHiehXvsmA","yoovlog","22","21.02.04","유트루|vlog|한국일상|유투버|Collab|Korean|먹방|가족|뷰티유튜버일상|mukbang|커플|부부|신혼|신혼일기|요리|출산|자연분만|출산브이로그|입원|병원|자연분만 회복|출산장면|출산 회복|조리원|산부인과","886729","17001","305","1561","https://i.ytimg.com/vi/GPRQGD2X9rg/default.jpg","False","False","안녕하세요 여러분?영상에서도 나오지만 3월 출산이 갑자기 몰리는 바람에 1인실을 원했지만 방이 없어서 4인실에 있어야 했고, 2박3일 입원 후 조리원에 올라가야 하지만 병실에서 더 대기 한 후 5일만에 조리원에 올라가게 되었습니다.딱히 불만이 있었던건 정말 아니구요, 애기 탄생이 많다는 건 어쨌든 좋은 일이다보니 다들 이해하면서 지내는 듯 했습니다. 저도 그랬구요!이해는 하지만 몸이 어려운 건 어쩔 수 없는 그런 거랄까요? 2박 3일 보내고 나니, 또 영상으로 편집하고보니 고작 2박3일인데 뭐 저렇게 힘들었나 싶기도 한데 막상 저 땐 마음이 약간은 서럽더라구요.안그래도 호르몬의 노예라고들 하던데..... 흣이것도 추억이죠 뭐!4인실이라 말도 별로 못 하고 거의 뭐 ASMR같은 입원기지만 올려봅니다!다음 영상은 조리원 영상으로 올게요!오늘도 함께 해주신 여러분 감사드리며...!! 다음 영상에서 뵙겠습니다 :)평소 사용/착용 제품 정보 올라가는 Instagram ID 👉🏻yootrue_infoInstagram ID 👉🏻yootrue5502유트루 헤어밴드👉🏻http://bit.ly/32HSmzN뽀끼함 (화장품 정리함)👉🏻http://bit.ly/2UjlhK7사용하는 카메라 거치대뽀끼스탠드 👉🏻 http://www.bbokki.co.kr 양면 마블 도마 (제작 상품)👉🏻https://bit.ly/3oM4fik채널 No.1 뷰티채널👉🏻 https://www.youtube.com/user/yootruebeutyroom/채널 No.2 생방송 채널👉🏻 https://www.youtube.com/c/yootrueonair"
"6sQ8NUZB_7U","저세상 면접자  - 【좋좋소 Ep.12】","2021-03-31T08:01:18Z","UCtfriFvIe5gIe8wRWb8UTMg","이과장","22","21.02.04","좋좋소|이과장|중낳괴|빠니보틀|중소기업|중소기업웹드|강성훈|조충범|이미나|충소기업 드라마","587771","8556","140","3063","https://i.ytimg.com/vi/6sQ8NUZB_7U/default.jpg","False","False","※ 실제 장소나 인물, 회사 등과는 관계 없는 픽션입니다.00:25 레디큐_90%할인가로_사는_꿀팁.tip이과장님처럼 쏘스윗한..💕 직장 동료가 되고 싶다면?오직 좋좋소 시청자분들만을 위해 준비한 히든 페이지에서좋좋소 특별 할인가로 레디큐를 만나보세요😘 👉https://bit.ly/2PmaA89이세화 - 통닭천사(https://youtube.com/channel/UCCzRvbziSmRY-ZYVmCnSBfw)면접자 - 뷰티풀너드(https://youtube.com/channel/UCe9f9MVu4WVCA3tVWtgSswA)이예영 - 진아진(https://instagram.com/jinactor_?igshid=2v5krtif1jxo)백진상 - 김경민(배우)조충범 - 남현우(https://instagram.com/korea_grandson)이미나 - 김태영(https://www.instagram.com/harukxxprofile)정사장 - 강성훈(https://www.youtube.com/channel/UClQDmyz9V93lA1mz2VG51ZA)정이사 - 조정우(https://instagram.com/brix_oddball)이과장 - 이과장(https://instagram.com/managerlee18)나레이션 - 여행자메이(https://youtube.com/c/TravelerMay)촬영 - 이태동(https://instagram.com/t.d_lee)음악 - 조정우(https://www.youtube.com/channel/UCJ-Q5uiqn8ycKEPzBxTOB0A)총 감독 - 빠니보틀(https://www.youtube.com/channel/UCNhofiqfw5nl-NeDJkXtPvw)"
"v7bnOxV4jAc","[MV] IU(아이유)_LILAC(라일락)","2021-03-25T09:00:31Z","UCweOkPb1wVVH0Q0Tlj4a5Pw","1theK (원더케이)","24","21.02.04","K-POP|Kpop|1theK|원더케이|Original|1theK Original|TOP100|idol|아이돌|라이브|LIVE|멜론|원더케이 오리지널|음악|IU|아이유|라일락|LILAC","18453851","1108456","15842","58731","https://i.ytimg.com/vi/v7bnOxV4jAc/default.jpg","False","False","[MV] IU(아이유)_LILAC(라일락)K-POP Wonderland, 1theKK-POP의 모든 즐거움을 1theK(원더케이)에서 만나보세요! :)Welcome to the official YouTube channel of K-POP Wonderland, 1theK1theK Originals Subscribe 👉 https://www.youtube.com/1theKOriginals[Notice] 1theK YouTube is also an official channel for the MV, and music shows will count the views from this channel too.[공지] 1theK YouTube는 MV를 유통하는 공식 채널로, 1theK에 업로드된 MV 조회수 또한 음악방송 순위에 반영됩니다.#NEWRELEASE#MV#1theK#원더케이▶1theK YT : https://www.youtube.com/1theK▶1theK FB  : http://www.facebook.com/1theK▶1theK TW : https://twitter.com/1theK▶1theK Kakao : https://goo.gl/otRpZc▶1theK TikTok : https://vt.tiktok.com/2mSMBS"
"9yneHTModes","[찜꽁습꽁] 상위 0.1% 천재 고양이 💖다홍이💖 모음! 세상에 다홍이 하버드 가야 할 것 같아요. (진심)ㅣ뷰티 앤 더 비스트 (beast)ㅣSBS ENTER.","2021-03-25T02:00:00Z","UCmjNKt6kITwaZTqvWuaSPLg","SBS Entertainment","24","21.02.04","다홍이|다홍|박수홍|뷰티앤더비스트|찜꽁습꽁|고양이|SBS|천재고양이","3368454","53091","1062","4150","https://i.ytimg.com/vi/9yneHTModes/default.jpg","False","False","이번엔 사심 200% 넣었습니다.편집자가 찜꽁한 천재 고양이 다홍이 모음💖#다홍이​ #박수홍​ #뷰티앤더비스트▶ Hompage : https://www.sbs.co.kr/tv/enter​▶ Subscribe SBS Entertainment : https://bit.ly/2SpOhMC"
"aUhFSgaPzaw","웅이가 얼마나 먹을지 몰라서 일단 라면 60봉 준비했습니다 | [미선이네👩‍🍳]","2021-03-26T09:00:00Z","UCJmcPVY4dC0e3L5_eemKtlg","미선임파서블 MISUN:IMPOSSIBLE","24","21.02.04","박미선|미선임파서블|박미선유튜브|내가 할게 누가 할래|누가할래|누가 할래|순풍산부인과|미달이엄마|박미선이경실|박미선이봉원|박미선김택용|박미선tv|박미선 인연|박미선 인생술집|박미선 개그|코미디언|예능인|꿀잼|예능|나는박미선|미션임파서블|히밥|먹방|MUKBANG|히밥 먹방|김밥|라면|라면 먹방|히밥 라면|푸드파이터|도전 먹방|mukbang|김밥 재료|대결|웅이|웅이 먹방|진라면|짜파구리|오징어짬뽕|신라면|너구리|콜라|대식가|푸드파이트|푸파|분식|분식집|장사|할머니|손자|국민손자|할머니와 손자|대접|식사|한끼|우삼겹|스팸|1인분","2172199","25549","707","1158","https://i.ytimg.com/vi/aUhFSgaPzaw/default.jpg","False","False","요원들 ~ 요하🙋‍♀️오늘은 유튜브를 보면서 정말 나를 울고 웃게 했던웅이님을 초대했습니다 👏👏 웅이 너무 잘 먹드라 ㅎ우리 채널에 나와줘서 너무 고맙구 요즘은 콜라 적당히 마시는 것 같아서 좋드라 웅아 ~☺️다음에 또 나와줘 😍우리 요원들도 영상 끝까지 봐주고 구독도 심심하면 눌러줘 😎미선에게 불가능이란 없다 [미선임파서블][웅이woongei] https://bit.ly/3rp1FzY[미선임파서블 구독] https://bit.ly/34ZhsNX#박미선 #미선임파서블 #웅이 #미선이네 #박미선유튜브 #요즘것들STAFF촬영: 그림형제음향: 빅스톤스튜디오믹싱: 매드벅스"
"ncfgAQ1542k","BTS(방탄소년단) - Dynamite (The Stage BTS Reloaded 2021) l KBS WORLD TV 210329","2021-03-29T13:53:14Z","UC5BMQOsAB8hKUyHu9KI6yig","KBS WORLD TV","24","21.02.04","kbs|kbsworld|kbs world|韓流|放送|韩国综艺|韩国电视剧|truyền hình Hàn Quốc|ประเทศเกาหลีใต้|ละคร|Corea|Corée|دراما|دراما كورية|kbskpop|yt:cc=on|kpop|KBSWorld|Korea|Korean|Drama|KBS|K-Pop|Entertainment|Documentary|Music|Bank|영어자막|English|Subtitle|kbsworldTV|Caption|World|뮤직뱅크|musicbank|kbs월드|월드TV|kbs 월드|world tv|worlddtv|koreaTV|koreanTV|korea TV|korean TV|케이팝|kTV|K TV|한국방송|월드|eng|sub eng|South Korea|idol stage|idol|KBS WORLD TV|BTS|방탄소년단|ARMY|Dynamite","983271","119250","396","3374","https://i.ytimg.com/vi/ncfgAQ1542k/default.jpg","False","False","▶ 10 Million Viewer Video Celebrating 10 Million Subscribers : https://youtube.com/playlist?list=PLMf7VY8La5RFS0XWTWFycvquksqgPeQ80▶ 2021 Music Bank clips : https://youtube.com/playlist?list=PLMf7VY8La5RExE1YkVdBCHpaLsay2SnNa▶ Editor's Pick! K-POP PLAYERhttps://youtube.com/playlist?list=PLMf7VY8La5RG9xT3U4l0GAPuA4CdeIi3R▶ The Return of Superman Highlights : https://youtube.com/playlist?list=PLMf7VY8La5RG7oxaRsdU9dR1xqmQF6EGQ▶ Stars' Top Recipe at Fun-Staurant Highlights : https://youtube.com/playlist?list=PLMf7VY8La5RFdeKBZ75VGl5sw0jRh3C-5▶ 2 Days & 1 Night Season 4 Highlights : https://youtube.com/playlist?list=PLMf7VY8La5RHuqYC9t6GcbapEGvrs1pQ3▶ 2020 KBS Song Festival : https://youtube.com/playlist?list=PLMf7VY8La5RH6K2FvOIaoSU__O0lb7a3t▶ Subscribe KBS WORLD TV Official PagesYoutube Subscribe：https://www.youtube.com/kbsworldHomepage: http://www.kbsworld.co.kr Facebook: http://www.facebook.com/kbsworldTwitter: http://twitter.com/kbsworldtv Instagram: https://www.instagram.com/kbsworldtv/Line: https://goo.gl/g5iRQVAndroid Download : http://bit.ly/1NOZFKrIOS Download : http://apple.co/1NktctW"
"-HVfBljdSWE","강승윤(KANG SEUNG YOON) - '아이야 (IYAH)' M/V","2021-03-29T09:00:00Z","UCayQxFAoFCvGariuQCtHRGQ","WINNER","10","21.02.04","YG Entertainment|YG|와이지|K-pop|WINNER|위너|Jinwoo|Seunghoon|Mino|Seungyoon|강승윤|김진우|이승훈|송민호|YOON|JINU|HOONY|MINO|INNER CIRCLE|이너서클|강승윤 PAGE|PAGE|KANG SEUNG YOON PAGE|강승윤 아이야|KANG SEUNG YOON IYAH|IYAH|아이야","6857869","162547","580","26264","https://i.ytimg.com/vi/-HVfBljdSWE/default.jpg","False","False","강승윤(KANG SEUNG YOON) - '아이야 (IYAH)'아 난 왜 이럴까?내일은 잘하자애써 맘을 다잡아봐도자꾸만 작아진다야 시간아 좀만천천히 가라요즘 부쩍 널 따라가기가조금씩 벅차다시간이 지나면 지날수록세상은 내게더 많은 걸 강요해나 하나도 힘든데나보고 어쩌라고난 아직 아이야이야우리 엄마 눈엔보이는 게 다 아니아니야아직 어린데실수 좀 하면 어때난 아직 아이야이야모진 세상 속에부담주지 마이야이야나도 사람인데어떻게 다 잘해아 또 이렇게 난제자리 걸음마뗐다 생각하고 뒤돌면한숨만 날 기다린다야 동생아 좀만천천히 와라널 마주치기에 아직내 모습이 초라하다시간이 지나면 지날수록세상은 내게더 많은 걸 강요해나 하나도 힘든데나보고 어쩌라고난 아직 아이야이야우리 엄마 눈엔보이는 게 다 아니아니야아직 어린데실수 좀 하면 어때난 아직 아이야이야모진 세상 속에부담주지 마이야이야나도 사람인데어떻게 다 잘해먹고 싶어 먹은 나이가 아닌데아직 내게 술은 쓰기만 한데열일곱에 내가 어제처럼 선명한데난 아직 아이야이야우리 엄마 눈엔보이는 게 다 아니아니야아직 어린데실수 좀 하면 어때난 아직 아이야이야모진 세상 속에부담주지 마이야이야나도 사람인데어떻게 다 잘해Albums Available @YG SELECT KR: https://www.ygselect.comYG SELECT EN: https://en.ygselect.comYG SELECT JP: https://jp.ygselect.comYG SELECT CN: https://cn.ygselect.comYG SELECT TH: https://ygselectth.com#강승윤 #KANGSEUNGYOON #PAGE #아이야 #IYAH #위너 #WINNER #YGMore about WINNER @http://www.yg-winner.com/http://www.youtube.com/OfficialYGWINNERhttp://www.facebook.com/OfficialYGWINNERhttp://twitter.com/ygent_officialhttp://sptfy.com/OfficialYGWINNERhttp://weibo.com/winnerasiahttps://www.instagram.com/winnercityhttps://www.instagram.com/yg_ent_official"
"QRd1iLqHBXY","특수부대 특전사 hid 출신이 바라보는 강철부대 리뷰 1-1","2021-03-28T13:28:24Z","UCCA4-eZAYGrgru7WHz7yhew","주라벨TV","17","21.02.04","강철부대|특수부대|채널a 강철부대|강철부대리뷰|특전사|특전사707|강철부대 특전사|강철부대 707|강철부대ssu|강철부대 해병수색대|강철부대 udt|강철부대sdt|강철부대해양결찰특공대|강철부대턱걸이|스파이더 챌린지|이진봉|강철부대 박중사|강철부대 육준서|강철부대 이진봉|강철부대박수민|강철부대 박준우|강철부대 hid|강철부대 격투기 선수|강철부대김상욱|강철부대 딥시다이버|대테러부대|해상특수부대|이근|참호격투|강철부대 1부|강철부대1","195905","1491","64","607","https://i.ytimg.com/vi/QRd1iLqHBXY/default.jpg","False","False","특전사 hid 출신이 바라보는 강철부대 리뷰..."
"v-yeh-EIjWA","[선공개] 아이유님도 찐자기였어...☆ 믿고 보는 유퀴즈 100회! 아이유재석(?) 조합+_+#유퀴즈온더블럭 | YOU QUIZ ON THE BLOCK EP.100","2021-03-31T01:33:21Z","UC920m3pMPH45qztdhppZhwA","유 퀴즈 온 더 튜브","24","21.02.04","유재석|유퀴즈|유퀴즈온더블럭|조세호","1691562","29696","439","2493","https://i.ytimg.com/vi/v-yeh-EIjWA/default.jpg","False","False","유 퀴즈 온 더 블럭매주 (수) 저녁 8시 40분 tvN#유퀴즈온더블럭 #유퀴즈 #선공개 #유재석 #조세호 #100회특집 #00의현실판 #아이유 #이지은"
"sIqRRrATxWQ","할아버지는 내가 살이 계속 찌면 어떻게 될까ㅋㅋㅋ [띠미]","2021-03-30T07:03:07Z","UC46BbEkxhjIHUj6EJ_waw-g","띠미 ddimmi","24","21.02.04","띠미|Elal|다이어트|요요|몰카|할아버지 몰카","221962","3652","140","315","https://i.ytimg.com/vi/sIqRRrATxWQ/default.jpg","False","False","안녕하세요!하고 싶은거 다 ~ 하고있는 엽기+병맛+발랄 예능 크리에이터 띠미입니다! (ᵔᗜᵔ*)♥▶업로드 : 화 목 일 or 월 화 목 일 오후 4시40분 ~ 5시 ▶유튜브 생방송 : 매주 토요일 6시 ~ 6시 30분(※ 사정에 의해 하루가 밀리거나 고정 업로드날에 업로드 안될 수 있는 점 양해 부탁드립니다.)띠미 인스타그램 ▶https://www.instagram.com/ddimmi96​비즈니스 문의 이메일 ▶ddimmi96@gmail.com"
"04tYkKUPPv4","LILAC (라일락)","2021-03-25T09:27:03Z","UCTUR0sVEkD8T5MlSHqgaI_Q","IU - Topic","10","21.02.04","IU|아이유(IU)|IU 5th Album 'LILAC'|LILAC|라일락","3067269","39246","781","12","https://i.ytimg.com/vi/04tYkKUPPv4/default.jpg","False","False","Provided to YouTube by Kakao EntertainmentLILAC (라일락) · IUIU 5th Album 'LILAC'℗ 2021 EDAM Entertainment,under license to Kakao EntertainmentReleased on: 2021-03-25Author: 아이유Composer: 임수호Composer: Dr.JOComposer: 웅킴Composer: N!koArranger: 임수호Arranger: 웅킴Arranger: N!koAuto-generated by YouTube."
"86BST8NIpNM","[MV] IU(아이유)_Coin","2021-03-26T09:00:01Z","UCweOkPb1wVVH0Q0Tlj4a5Pw","1theK (원더케이)","24","21.02.04","K-POP|Kpop|1theK|원더케이|Original|1theK Original|TOP100|idol|아이돌|라이브|LIVE|멜론|원더케이 오리지널|음악|아이유|IU|Coin|coin|코인","6022695","493486","3895","24967","https://i.ytimg.com/vi/86BST8NIpNM/default.jpg","False","False","[MV] IU(아이유)_CoinSampled intro sound, created by Niv Gold @Nivgo.comK-POP Wonderland, 1theKK-POP의 모든 즐거움을 1theK(원더케이)에서 만나보세요! :)Welcome to the official YouTube channel of K-POP Wonderland, 1theK1theK Originals Subscribe 👉 https://www.youtube.com/1theKOriginals[Notice] 1theK YouTube is also an official channel for the MV, and music shows will count the views from this channel too.[공지] 1theK YouTube는 MV를 유통하는 공식 채널로, 1theK에 업로드된 MV 조회수 또한 음악방송 순위에 반영됩니다.#NEWRELEASE#MV#1theK#원더케이▶1theK YT : https://www.youtube.com/1theK▶1theK FB  : http://www.facebook.com/1theK▶1theK TW : https://twitter.com/1theK▶1theK Kakao : https://goo.gl/otRpZc▶1theK TikTok : https://vt.tiktok.com/2mSMBS"
"xGvKZMZOXUg","[놀면 뭐하니? 후공개] MSG 워너비 1차 블라인드 오디션 풀영상  [도경완 (이정재) - 약속]","2021-03-27T11:14:45Z","UCx6jsZ02B4K3SECUrkgPyzg","놀면 뭐하니?","24","21.02.04","유재석|유플래시|유산슬|뽕포유|라섹|유르페우스|놀면 뭐하니|놀뭐|무도|환불원정대|싹쓰리|refund sisters|hangout with yoo|이효리|엄정화|마마무|제시|화사|천옥|만옥|실비|은비|봉원|지섭|지미유|김태호|정재형|김종민|예능|비룡|린다G|조지리|이상순|유희열","759460","12248","143","2879","https://i.ytimg.com/vi/xGvKZMZOXUg/default.jpg","False","False","★★★More 'Hangout with Yoo' clips are available★★★iMBChttp://www.imbc.com/broad/tv/ent/hangoutwithyoo/vod/WAVVEhttps://www.wavve.com/player/vod?programid=M_1004711100000100000&page=1"
"Gp0mJx8X84E","No밀가루! 계란말이보다 훨씬 쉽고 맛있는 두툼한 계란부침개 만들기","2021-03-28T23:32:59Z","UCWrh9haWsTEAQF9UEg6AEFQ","소소황 Cook & Eat","26","21.02.04","계란부침|계란부침 만들기|계란부침 레시피|계란부침개 만들기|계란요리|계란전|계란전 만들기|간단요리|간단한 요리|간단레시피|전 만들기|전부치기|반찬만들기|술안주|술안주 요리|korean food|korean food recipes|egg recipes|egg pancake|egg pancake recipe|egg dishes|양배추 부침개|양배추전 만들기|부침개 만들기|부침개 만드는 법","501054","3149","67","114","https://i.ytimg.com/vi/Gp0mJx8X84E/default.jpg","False","False","계란말이보다 만들기 쉽고 한끼 식사로도 든든한 영양만점 계란부침개 레시피.계량은 계량 스푼과 계량 컵 기준입니다.계량스푼 1큰술 = 15ml일반숟가락 1스푼 = 10~12ml계량스푼 1작은술 = 5ml계량컵 1컵 = 200ml종이컵 1컵 = 180~190ml-재료-계란 5개쪽파 4줄양파 1/4개부추 약간당근 약간양배추 70g청양고추 2개홍피망 1/4개맛살 2개소금 1/3작은술-Ingredients-five eggs1/4 onionsome leeksome chivessome carrot70g cabbagetwo hot peppers1/4 red bell pepper2 pieces of crab1/3 teaspoon salt#계란요리#계란부침개#간단요리Track: Blue — Declan DP [Audio Library Release]Music provided by Audio Library PlusWatch: https://youtu.be/Tu63TwPG0RAFree Download / Stream: https://alplus.io/Blue"
