video_id,title,publishedAt,channelId,channelTitle,categoryId,trending_date,tags,view_count,likes,dislikes,comment_count,thumbnail_link,comments_disabled,ratings_disabled,description
"o17P8nviGa0","내가 뭐든 쉽게 부르는 줄 알았어? | 연습 별로 안 했어요, 50시간 정도 (feat. 이수현)","2021-03-25T10:59:15Z","UCSQ55iSysqYErLRDC6ARi9w","티키틱 TIKITIK","24","21.02.04","Project SH|ProjectSH|프로젝트 SH|프로젝트SH|이신혁|오세진|추추|김은택|신혁|세진|은택|뮤지컬|아카펠라|하이스쿨잼|하이스쿨 잼|온웨이즈|립싱크|티키틱|Tikitik|이수현|악뮤|악뮤 수현|연습 별로 안 했어요|연습 별로|50시간 정도","800870","35424","50","2570","https://i.ytimg.com/vi/o17P8nviGa0/default.jpg","False","False","수없이 걸어도 낯선 길도 있더라고.티키틱의 평균 수명을 5년 정도 늘려주신AKMU 수현님과 함께했습니다🎉메이킹 필름은 4월 1일 목요일에 공개됩니다!!🎙️티키틱 구독하기: https://goo.gl/65vAdv🎙️ 사실 연습 많이 함 : @Leesuhyun  @akmu_suhyun🎵 감독, 작사, 작곡 : @이신혁  @project_sh🎭 개그 직접 고안함 : 세진 @3jin5💡 조명 : 추추 @choo__oong🎨 타이틀 : @은택  @wavideo-------------------------[연습 별로 안 했어요, 50시간 정도 - 티키틱]작사 : 이신혁작곡 : 이신혁편곡 : 이신혁-------------------------✔가사했지 그럼 당연히 했지낮이고 밤이고 끝없이가벼운 부담은 없으니까여전히, 아 물론 말은(별로 안 했어요)노련한 모습 중요하지집중 카리스마 그런 거근데도 고장이 난다니까여전히, 또 그럼 나는여전히 떨리고여전히 또 서먹하고여전히 무뎌지지 않고 처음 같은 조각수없이 걸어도낯선 길도 있더라고 (변함없이)연습 별로 안 했어요, 50시간 정도이번에 가장 많이 한 거지우고 날리고 뒤엎고TV 속 능력자가 부럽다여전히, 아 물론 말은낯 가리지 말자 티 내지 말자꼭 한마디만 웃기자...다 먹히는 건 아니니까그 말만큼은여전히 떨리고여전히 또 서먹하고여전히 무뎌지지 않고 처음 같은 조각수없이 걸어도낯선 길도 있더라고 (변함없이)연습 별로 안 했어요...(여전히 떨리고 여전히 또 서먹하고여전히 무뎌지지 않고 처음 같은 조각수없이 걸어도)낯선 길도 있더라고 (변함없이)연습 별로 안 했어요, 50시간 정도단단한 쪽도 나이기에무른 쪽도 나이기에단단한 쪽도 나이기에무른 쪽도 나이기에🎶티키틱 공식 계정(인스타): https://www.instagram.com/tikitik.official🎶티키틱 공식 계정(페북): https://www.facebook.com/tikitik.official#티키틱 #이수현"
"fDItj8LpxzI","호박 있으세요? 아주 부드럽고 달콤한 요리가 완성됩니다 / 호박계란요리","2021-03-24T05:12:46Z","UCn64fSqF2l4rkkjtQUpku2A","집나간아들 Runaway Son","26","21.02.04","호박|계란|달걀|호박요리|호박찜|애호박찜|애호박|애호박요리|달걀요리|계란요리|애호박전|호박계란|요리|예쁜요리|쉬운요리|맛있는요리|다이어트음식","663097","3757","125","308","https://i.ytimg.com/vi/fDItj8LpxzI/default.jpg","False","False","재료애호박 2개계란 4개대파 혹은 쪽파고추깨마늘소금후추굴소스 1스푼뜨거운 기름선택간장 1스푼식초 0.5 스푼구독은 무료입니다.감사합니다.비지니스 문의 alstlr9202@gmail.com"
"On0coppqs1w","[#습핫습핫] 내 여자들이 돌아왔습니다..❤ (ft. 잇몸이 마르다 눈에서 땀이 나는 상황) | 펜트하우스2(Penthouse2) | SBS DRAMA","2021-03-27T01:00:02Z","UC6erIDuvbOaAO-OT5rB2Xew","SBS Drama","24","21.02.04","김영대|심수련쌍둥이|천서진|주단태|펜트하우스이지아|나애교|이지아쌍둥이|이지아나애교|김현수|주석훈|배로나|김영대김현수|하은별|최예빈|펜트하우스|펜트하우스2|김소연|유진|엄기준|김소연엄기준|펜트하우스다시보기|Penthouse2|EUGENE|金素姸|KimSoyeon|이지아|성악|펜트하우스2 11회|펜트하우스11회","1317251","18791","148","1794","https://i.ytimg.com/vi/On0coppqs1w/default.jpg","False","False","SBS 금토드라마 '펜트하우스 시즌2'☞ 매주 금, 토 밤 10시 본방송#펜트하우스2​ #김영대 ​#이지아 #김현수▶ Hompage : https://www.sbs.co.kr/tv/drama​▶ Subscribe SBS Drama : https://bit.ly/2ShWout​"
"GVh-2Wl9Rck","[몰카]여자후배가 우리집에 배달을 온다면? 4탄 ft. 권재관,김경아","2021-03-28T08:00:00Z","UCgBLs7gZMeYV-V-Z9983Z2w","투마리","23","21.02.04","투마리|꼰대희|Sub|개그맨|공포|Air Drop|몰카|낄낄상회|미녀|무서운이야기|드립팩토리|깨방정|걸깝스|오도씨|백마TV|배달의민족|바그냥","181967","2264","63","890","https://i.ytimg.com/vi/GVh-2Wl9Rck/default.jpg","False","False","#투마리 #몰카 #배달의민족[몰카]여자후배가 우리집에 배달을 온다면? 4탄정인이 서식지아프리카tv 저닝 검색해주세요!!브금출처-평범한 피아니스트 : 추억에잠기다                                      Nothing is Funny                                      Trial After Trials"
"ww6zzzwZcgs","시청자에게 혼쭐 난 '조선구마사'…사상 초유 '방송 퇴출' (2021.03.26/뉴스데스크/MBC)","2021-03-26T11:30:16Z","UCF4Wxdo3inmxP-Y59wXDsFw","MBCNEWS","25","21.02.04","MBC|MBC뉴스|뉴스데스크|newsdesk|뉴스투데이|newstoday|8시뉴스|아침뉴스|뉴스|정오뉴스|news|조선구마사|역사왜곡|동북공정","1211671","17251","294","8575","https://i.ytimg.com/vi/ww6zzzwZcgs/default.jpg","False","False","중국풍 설정과 역사왜곡으로 논란을 일으킨 SBS 드라마 '조선구마사'가 방송 2회 만에 결국 폐지됐습니다.이 드라마는 조선시대 설정을 중국식으로 묘사하고 또, 세종대왕과 여러 인물들을 모욕했다는 논란이 일었는데요.비판이 거세지면서 광고가 잇따라 해지됐고 제작 지원도 줄줄이 철회됐습니다.https://imnews.imbc.com/replay/2021/nwdesk/article/6130449_34936.html#조선구마사 #역사왜곡 #동북공정"
"hGfDwxwJ8HQ","[뉴스터치] 배달 음식값 나 몰라라 '쿠팡 거지' (2021.03.26/뉴스투데이/MBC)","2021-03-25T22:14:55Z","UCF4Wxdo3inmxP-Y59wXDsFw","MBCNEWS","25","21.02.04","MBC|MBC뉴스|뉴스데스크|newsdesk|뉴스투데이|newstoday|8시뉴스|아침뉴스|뉴스|정오뉴스|news|쿠팡거지|쿠팡이츠|사건","983588","6364","158","3616","https://i.ytimg.com/vi/hGfDwxwJ8HQ/default.jpg","False","False","쿠팡이츠로 음식을 주문한 뒤, 음식만 챙기고 돈을 내지 않는 얌체들을 '쿠팡 거지'라고 일컫는데요. 배달기사들의 피해가 커지고 있습니다.https://imnews.imbc.com/replay/2021/nwtoday/article/6129659_34943.html#쿠팡거지, #쿠팡이츠, #사건"
"v63XmlzRuac","[코다리] 흥국생명 투혼의 챔프전 진출 현장! 눈물바다가 되어버렸네ㅠㅠ","2021-03-25T01:16:08Z","UC-QIqPAffXGJVgy_tnn145w","KOVO","17","21.02.04","KOVO|코보|한국배구연맹|배구|프로배구|남자배구|여자배구|V리그|V-리그|코보티비|고예림|스페셜v|kovotv|경기의재구성|황민경|다같이산다|문정원|전광인|gs칼텍스|ibk기업은행|흥국생명|한국도로공사|kgc인삼공사|현대건설|현대캐피탈|대한항공|우리카드|삼성화재|kb손해보험|ok금융그룹|김연경|브루나|김다솔|박상미|박현주|이주아|식빵언니|텐션|박은서|암흑|흥국이들|투혼|붕대투혼|김연경붕대|챔프전|플레이오프승리|챔프전진출|챔피언결정전|승리송|승리의세레나데|눈물|눈물바다","293589","3050","75","0","https://i.ytimg.com/vi/v63XmlzRuac/default.jpg","True","False","흥국생명 투혼의 챔프전 진출 현장!눈물바다가 되어버렸고,,,상미는 승리송을 불렀고,,,#흥국생명 #챔프전_진출 #김연경_투혼"
"GNx5fnhNi_E","BTS(방탄소년단) - Life Goes On (Let's BTS!) l KBS WORLD TV 210329","2021-03-29T16:28:09Z","UC5BMQOsAB8hKUyHu9KI6yig","KBS WORLD TV","24","21.02.04","kbs|kbsworld|kbs world|韓流|放送|韩国综艺|韩国电视剧|truyền hình Hàn Quốc|ประเทศเกาหลีใต้|ละคร|Corea|Corée|دراما|دراما كورية|kbskpop|yt:cc=on|kpop|KBSWorld|Korea|Korean|Drama|KBS|K-Pop|Entertainment|Documentary|Music|Bank|영어자막|English|Subtitle|kbsworldTV|Caption|World|뮤직뱅크|musicbank|kbs월드|월드TV|kbs 월드|world tv|worlddtv|koreaTV|koreanTV|korea TV|korean TV|케이팝|kTV|K TV|한국방송|월드|eng|sub eng|South Korea|idol stage|idol|KBS WORLD TV|BTS|방탄소년단|ARMY|Life Goes On|RM|Suga|J-Hope|Jimin|Jungkook","4581240","595229","5629","20979","https://i.ytimg.com/vi/GNx5fnhNi_E/default.jpg","False","False","▶ 10 Million Viewer Video Celebrating 10 Million Subscribers : https://youtube.com/playlist?list=PLMf7VY8La5RFS0XWTWFycvquksqgPeQ80▶ 2021 Music Bank clips : https://youtube.com/playlist?list=PLMf7VY8La5RExE1YkVdBCHpaLsay2SnNa▶ The Return of Superman Highlights : https://youtube.com/playlist?list=PLMf7VY8La5RG7oxaRsdU9dR1xqmQF6EGQ▶ Stars' Top Recipe at Fun-Staurant Highlights : https://youtube.com/playlist?list=PLMf7VY8La5RFdeKBZ75VGl5sw0jRh3C-5▶ 2 Days & 1 Night Season 4 Highlights : https://youtube.com/playlist?list=PLMf7VY8La5RHuqYC9t6GcbapEGvrs1pQ3▶ Editor's Pick! K-POP PLAYERhttps://youtube.com/playlist?list=PLMf7VY8La5RG9xT3U4l0GAPuA4CdeIi3R▶ Subscribe KBS WORLD TV Official PagesYoutube Subscribe：https://www.youtube.com/kbsworldHomepage: http://www.kbsworld.co.kr Facebook: http://www.facebook.com/kbsworldTwitter: http://twitter.com/kbsworldtv Instagram: https://www.instagram.com/kbsworldtv/Line: https://goo.gl/g5iRQVAndroid Download : http://bit.ly/1NOZFKrIOS Download : http://apple.co/1NktctW"
"r7eqdFGrQAA","프랑스 여자가 한국에 와서 겪은 충격적인 신체 변화","2021-03-27T07:00:06Z","UCudezj2i6R94QOPqGJhbZwg","어썸 스토리 Awesome STORY","24","21.02.04","[none]","484357","13270","91","464","https://i.ytimg.com/vi/r7eqdFGrQAA/default.jpg","False","False","충격 실화! 현지 프랑스 어머님이 보고 손발을 벌벌 떠셨을 정도라는데요,오늘은 프랑스에서 오신 카이나님께서 한국에 와서 겪은 충격적인신체 변화와 내적 변화에 대해서 말씀 해주셨습니다!영상이 궁금하시다면 지금 바로 보러~가시죠!출연자 인스타그램 : @ina_change#외국인​​ #한국​​ #해외반응@AWESOME한 출연자들을 다른곳에서도 보고싶다면@♥영상이 재미있으셨다면 구독 좋아요 누르는 센스♥☞추천하는 영상이나 도전해봤으면 하는 것들이 있으면 '댓글'로 남겨주세요!※어썸스토리의 또 다른 재밌는 영상들도 만나보세요!출연 및 제휴 문의 : wognswotjr@gmail.com"
"p2aWymp1KDs","강다니엘(KANGDANIEL) - 'YELLOW' Comeback Trailer","2021-03-25T15:00:14Z","UCHGJwrjlY6rmZJInxRmiztA","KONNECT Entertainment","10","21.02.04","[none]","294071","45108","101","3850","https://i.ytimg.com/vi/p2aWymp1KDs/default.jpg","False","False","강다니엘(KANGDANIEL) - 'YELLOW' Comeback Trailer#강다니엘 #KANGDANIEL #YELLOWOfficial Homepage : https://danielk.konnectent.comOfficial Twitter : https://twitter.com/konnect_danielkOfficial Instagram :https://www.instagram.com/konnect_kangdanielArtist Instagram :https://www.instagram.com/daniel.k.here/Official V LIVE : https://channels.vlive.tv/B019E3/home"
"BEyeVIBYaiA","사람 조아ㅠ.ㅠ🐶 친화력+순둥미 폭발하는 티아라 지연? #highlight #온앤오프#온앤오프 | onandoff EP.37","2021-03-23T17:22:24Z","UC78PMQprrZTbU0IlMDsYZPw","tvN","24","21.02.04","넉살|성시경|엄정화|온앤오프|윤박|초아|한채아","821694","9172","291","1229","https://i.ytimg.com/vi/BEyeVIBYaiA/default.jpg","False","False","#온앤오프화요일 밤 10시 30분 tvN"
"eFD_V6lGvkc","[ENG SUB] 아이유(IU)와 함께 떠나는 추억여행! 90년대생들 핵공감할 추억의 아이템! (열쇠고리, 아폴로, 공기, 샤기컷, 젤리슈즈) by W Korea","2021-03-24T11:00:15Z","UCjO3ji06DxmTM1RrzLVwmkA","W Korea 더블유 코리아","24","21.02.04","IU|아이유|Dlwlrma|LeeJieun|이지은|李知恩|라일락|추억템|kpop|더블유 매거진","482414","22615","128","1390","https://i.ytimg.com/vi/eFD_V6lGvkc/default.jpg","False","False","20대 끝자락을 마주한 #아이유 ! 지나온 시간들을 돌이켜보며 #90년대생 들이 무릎 탁! 칠만한 아이템들로 추억여행을 떠났습니다. 아이유는 어떤 어린 시절, 학창 시절을 보냈을까요? 좋아하던 간식부터 장난감, 헤어스타일, 그 시절 패션템까지! #W히든백 에서 아이유와 함께 추억 봉인 해제시켜드립니다. 90년대생들 모여라! -콘텐츠 에디터ㅣ손정은패션 에디터ㅣ박연경촬영ㅣ손정은 양정윤편집ㅣ손정은스타일리스트ㅣ노주희헤어ㅣ이지(PRANCE)메이크업ㅣ왕빛나 김채영(Team Overmars)네일ㅣ허진희(허앤밀네일)세트ㅣ유혜원(Blank)주니어 에디터ㅣ이윤지 문선영"
"O_KCBznymPM","출산 브이로그🤰🏻자연 분만, 일주일 진통 기다리며 먹부림🍛, 순산 기 받아가세요!!","2021-03-23T14:56:09Z","UCkh6TlSape86-iHiehXvsmA","yoovlog","22","21.02.04","유트루|vlog|한국일상|유투버|Collab|Korean|먹방|가족|뷰티유튜버일상|mukbang|커플|부부|신혼|신혼일기|요리|출산|자연분만|자연분만브이로그|진통|자연진통|아기|탄생|산부인과|임신","856296","24000","237","2693","https://i.ytimg.com/vi/O_KCBznymPM/default.jpg","False","False","안녕하세요 여러분!브이로그 채널에서 이렇게 출산 소식을 영상으로 알립니다 😬인스타에서는 이미 인사드린지 오래고, 사진도 꽤나 올렸지만 인스타 안 하시는 분들은 출산 소식 이제야 알게 되실 것 같습니다.저는 굉장히 순산 했구요, 아기를 낳은 지금은 다시 태어난 듯 체력이 너무 좋아서 완전 에너자이너가 되었습니다.제 33년 평생 이렇게 체력 좋았던 적이 없었는데 출산하고 몸이 확 좋아진 느낌이에요!출산을 기다리면서 어떻게 지냈는지부터 자두씨가 태어나는 순간까지 담아보았는데요,주사의 어려움이 있었긴 했어도 간호사 선생님들 덕에 어쨌든 주사도 잘 맞았고 너무나 순산 했답니다 ❤️여러분들 많이 걱정해주시고 응원해주셔서 감사드립니다.임신과 출산을 앞두신 분들이 이영상을 보신다면 제 임신 기!! 순산 기!! 팍팍 받아가세요!오늘도 함께 해주신 여러분 감사드립니다 🙏🏻평소 사용/착용 제품 정보 올라가는 Instagram ID 👉🏻yootrue_infoInstagram ID 👉🏻yootrue5502유트루 헤어밴드👉🏻http://bit.ly/32HSmzN뽀끼함 (화장품 정리함)👉🏻http://bit.ly/2UjlhK7사용하는 카메라 거치대뽀끼스탠드 👉🏻 http://www.bbokki.co.kr 양면 마블 도마 (제작 상품)👉🏻https://bit.ly/3oM4fik채널 No.1 뷰티채널👉🏻 https://www.youtube.com/user/yootruebeutyroom/채널 No.2 생방송 채널👉🏻 https://www.youtube.com/c/yootrueonair"
"QDZgF9Uo484","전기차는 한계가 있다! 세계 1위 자동차 기업 도요타의 My Way","2021-03-24T11:29:44Z","UCsJ6RuBiTVWRX156FVbeaGg","슈카월드","23","21.02.04","슈카|슈카월드|경제|시사|이슈|뉴스|상식|면접|논술|자소서|취업|주식|증시|주가|시장|자산|투자|금리","774153","10392","436","2078","https://i.ytimg.com/vi/QDZgF9Uo484/default.jpg","False","False","어렵고 딱딱한 경제,시사,금융 이야기를쉽고 유쾌하게 풀어내는 경제/시사/이슈/잡썰 토크방송입니다.#하이브리드 #수소차"
"wUI0IPNBbYo","🏠 26평 아파텔로 이사하는 브이로그 🏠","2021-03-25T03:00:06Z","UCII-TCayU-6gkfzfgJKsFZw","망구 MANGOO","22","21.02.04","[none]","238822","0","0","574","https://i.ytimg.com/vi/wUI0IPNBbYo/default.jpg","False","True","#이사 #브이로그 #실버버튼아뇽아뇽~ 예쁘고 멋진 우리 망둥어들~아픈 곳은 없나요? 잘 지내셨죠?너무너무 보고싶었어요!!정말 오랜만에 브이로그를 들고왔어요 ㅎㅎ바로바로 이사하는 브이로그!제가 드디어 20평대 아파트에 살게 되는 날이 왔네요 ㅠㅠ이게 전부 다 우리 망둥어들 덕분이에요정말 너무너무 고맙고 감사드려요..😊 이제부터 영상이 쫘라락 올라갈테니까 더 이상 기다리게 하는 일은 없을 거예요!!사랑합니다 아프지 마시고 늘 건강만 하세요 :)언제나 곁에 행운이 함께 하길 저 망구가 기도할게요 우리 이제 재미나게 살아보자!!새로운 집에서의 일상 브이로그 많이많이 기대해주세요 XD💓 ▬▬▬▬▬▬▬▬▬▬▬▬▬▬▬▬▬▬▬▬▬▬▬▬▬▬▬▬▬▬▬▬▬▬▬▬▬▬▬▬▬▬▬▬▬▬▬▬▬▬▬▬▬▬▬▬▬▬▬▬▬▬▬▬▬▬▬▬▬▬▬▬▬▬▬▬▬▬▬▬▬▬▬▬▬▬▬-정보-👉MLB # 플 레이볼 뮬 모노 데님 NY # BLUE👉MLB # 청키 로우 B # WHITE👉MLB # 레인보우 모노그램 스트럭쳐 볼캡 NY # WHITE👉NIKE # 에어포스1 LV8 더블스우시 운동화 CW1574-100👉물결 반지 - https://a-bly.com/app/goods/1903726👉가디건 - 프롬데이원 # 더블린 벌룬 라운드 가디건 # 그레이 (품절)👉폴라로이드 - https://link.coupang.com/re/CSHARESDP?lptag=CFM25780840&pageKey=1685518330&itemId=2870907718&vendorItemId=70860113770 👉폴라로이드 필름 - https://link.coupang.com/re/CSHARESDP?lptag=CFM25780840&pageKey=163802457&itemId=470015974&vendorItemId=4173786428👉장어집 - http://naver.me/IDEzzTzz 👉흔들 의자 - https://ohouse.onelink.me/2107755860/623141f4👉인조 잔디 - https://link.coupang.com/re/CSHARESDP?lptag=CFM25780840&pageKey=1947295705&itemId=3306232118&vendorItemId=71293137954👉입욕제 - 구뜨앙쥬 # 키프로스 섬의 조개 (협찬)▬▬▬▬▬▬▬▬▬▬▬▬▬▬▬▬▬▬▬▬▬▬▬▬▬▬▬▬▬▬▬▬▬▬▬▬▬▬▬▬▬▬▬▬▬▬▬▬▬▬▬▬▬▬▬▬▬▬▬▬▬▬▬▬▬▬▬▬▬▬▬▬▬▬▬▬▬▬▬▬▬▬▬▬▬▬▬[Video Source Support]모든 영상 소스 다운로드 출처 : 유튜브 “프리티콘” 리코더 러브하우스 브금 : https://www.youtube.com/watch?v=mRGO6-vQelg🎵Music provided by 브금대통령🎵Track : Some Vintage Mood 5 - https://youtu.be/e0X1quVKQmI​🎵Music provided by 브금대통령🎵Track : Naptime! - https://youtu.be/3fBloNLBL2Y​🎵Music provided by 브금대통령🎵Track : 청춘 로맨스 - https://youtu.be/yu5vTRS9DpE​▬▬▬▬▬▬▬▬▬▬▬▬▬▬▬▬▬▬▬▬▬▬▬▬▬▬▬▬▬▬▬▬▬▬▬▬▬▬▬▬▬▬▬▬▬▬▬▬▬▬▬▬▬▬▬▬▬▬▬▬▬▬▬▬▬▬▬▬▬▬▬▬▬▬▬▬▬▬▬▬▬▬▬▬▬▬▬Instagram  | @mangoo_6E-mail | mango00o@naver.com"
"RlTkZEdkGm4","[자매대결] 옷 잘입는줄 아는 동네언니들 일주일 코디대결 | 디바걸스","2021-03-26T08:30:01Z","UCghP93LBNk1EGBr5gFJg20Q","디바걸스","23","21.02.04","디바걸스|디바제니|디바제시카","201481","5527","79","1482","https://i.ytimg.com/vi/RlTkZEdkGm4/default.jpg","False","False","유튜버 ‘디바제시카’와 ‘디바제니’ 친자매의 현실예능!코디, 먹방, 뷰티, 일상,하울, 걸스토크, 리액션, 상황극.. 우린 그냥 다해~* 비지니스 문의: jbsnetwork7@gmail.com■ BGM정보BGM by 비지엠팩토리 https://www.bgmf3ctory.com​- 페퍼민트- 깜빡깜빡- 이런- 토끼의 하루- 욕심쟁이- 저 놈 또 시작- 산책하러 나가요!- 다급한 발걸음- 탐정들의 입소문- 실수 연발- 아기와 나- 강아지- 모래알은 반짝- 만들어볼까- 억울한 표정- 인생이 시트콤- 소소한 이야기- 긍정파- 흉내- 달달한 달- 스탠드업 코미디- 군밤- 개가 되었다- 웃프다- 정적- 폼 잡고- 억울한 표정- 의심- 저녁을 향해- 집중하는 시간- 긍정파- 천진스레- 두리번- 까불이- 결혼은 무슨- 실패했지만 귀엽게 봐주세요🎵Music provided by 브금대통령🎵Track : 그 빵은 내꺼야  - https://youtu.be/Jyh4ETOLIhQ🎵Track : Black Comedy - https://youtu.be/gHlSF3VpB9U🎵Track : Waltz for Golden Retriever - https://youtu.be/uySw78v2ZR0🎵Track : Une Petite Dispute - https://youtu.be/NWITLjXsBj4"
"LV8Ezog59cI","Brave Girls, Rollin’(브레이브걸스, 롤린) [THE SHOW 210323]","2021-03-23T10:39:25Z","UCoRXPcv8XK5fAplLbk9PTww","The K-POP","10","21.02.04","K-pop|Kpop|SBS|Korea|sbsmedianet|210323|THE SHOW|더쇼|더쇼라이브|Brave Girls|Rollin’|브레이브걸스|롤린","940519","32472","280","2603","https://i.ytimg.com/vi/LV8Ezog59cI/default.jpg","False","False","#브레이브걸스, 롤린#Brave_Girls #Rollin’채널에 가입하여 혜택을 누려보세요.https://www.youtube.com/channel/UCoRXPcv8XK5fAplLbk9PTww/joinThe K-POP All about K-POP in Korea!Official  K-POP YouTube channel of SBS Medianet.Please don’t forget to click Subscribe.Enjoy your YouTube life with THE K-POP."
"0LQzsw8uuvw","“클래식 천재 x 프리스타일 천재” 바이올린으로 무대를 뒤집으셨다..ㄷㄷㄷ","2021-03-23T11:00:00Z","UCSy5l865pfrmUCdpOyMqLpQ","헨리 Henry Lau","24","21.02.04","헨리|Henry|刘宪华|Henrylau|같이헨리|같이 핸리|같이핸리|같이 헨리|고소현|브람스를좋아하세요|드라마 브람스|영재|음악천재|신동|같이헨리시즌2|시즌2|헨리 고소현|Pinchas Zukerman|바이올린|바이올린신동|헨리 영재|헨리영재|음악천재헨리|클래식|명악기|명품악기|명품|BTS|바이올린 대결|Dynamite|방탄소년단|방탄dynamite|바이올린 Dynamite|바이올린다이너마이트|헨리 다이너마이트|바이올린대결|vs바이올린|Violin prodigy|Henry Together|henrytogether|old instrument|Paganini Caprice|파가니니 카프리스|독주|Por Una Cabeza|여인의 향기|탱고|tango|프리스타일|freestyle|자작곡|First Guest|Classic|performance|콜라보|바이올린콜라보|바이올린 콜라보|Violinist|World Star","661348","32259","201","2943","https://i.ytimg.com/vi/0LQzsw8uuvw/default.jpg","False","False","헨님이들 안녕!지난주 시즌2 첫 번째 게스트 바이올린 천재 소현이와 함께한 영상 재밌게 보셨나요?이번에도 역시 소현이와 즐겁게 콜라보를 해봤는데요헨님이들이 많이 기대하고 계신 이번 영상지금 공개하니 재미있게 봐주세요~!!#같이헨리2 #고소현 #DynamiteHi Hennims~!Did you enjoy last weeks episode with our first guest of season 2, Sohyun? Well this week you finally get to see our special performances!  I think it came out pretty good for not having practiced together before~! What do you think?Hope you enjoy~!#HenryTogetherSeason2 #SohyunKoHenry Instagram  https://www.instagram.com/henryl89/ Monster Entertainment Group Instagram https://www.instagram.com/monster.entertainmentProduced by : Monster Entertainment X The KIT Corp.Writer/Director : Sera DoProduction: Container Lab"
"wNVrdUyM01M","BMW 7시리즈가 반값에 팔리는 이유 [카푸어] 18부","2021-03-23T12:30:18Z","UCIueALBHAyPPU7e7C2zVYRQ","직업의모든것","24","21.02.04","[none]","644864","6434","444","1257","https://i.ytimg.com/vi/wNVrdUyM01M/default.jpg","False","False","인터뷰문의: tlsdn2486@naver.com00:07 중고차수출 박준규입니다00:20 파괴전문 유튜버 00:26 재떨이가 달린 차 00:50 15인승 승합차가 요르단에 가면 이렇게 쓰여요 01:00 차 위에다 소도 2마리 실어요01:13 오토바이도 2대 실어요 01:15 사람도 25명이 타요 01:25 비포장도로 산기슭을 시속200km로 달려요01:42 K5 마후라 튜닝을 하는 이유02:00 BMW730d 이차 마음에 드시면 반값에 드릴게요02:20 아반떼 가격에 7시리즈 탈수있어요 03:01 흔한 기스 03:17 파괴된 중고차 03:35 깨끗한 제네시스G80을 수출보내는 이유04:40 제네시스는 정말 좋은 차에요05:07 병원 구급차도 수출보내요 05:50 우리나라 중고 소방차를 몽골에서 사가요06:17 중고 자전거도 수출보내요06:50 긍정적으로 생각해야해요 07:05 한국은 지금 너무 부자로 살아서 가난했던 시절을 몰라요07:30 중고 포크레인도 수출보내요07:42 중장비는 움직일 수 있는 가능성만있다면 수출보내요 08:01 수출단지의 주차관리법 08:12 이곳에서마저 K5가 과학인 이유 08:52 80년대 진짜 간지 09:15 중앙아시아에서 좋아하는 차 브랜드 직업의모든것 멤버쉽에 가입해주세요 ^_^ https://www.youtube.com/channel/UCIueALBHAyPPU7e7C2zVYRQ/join"
