video_id,title,publishedAt,channelId,channelTitle,categoryId,trending_date,tags,view_count,likes,dislikes,comment_count,thumbnail_link,comments_disabled,ratings_disabled,description
"M3YdWaixPxY","HOSHI 'Spider' Official Teaser 1","2021-03-30T15:00:01Z","UC3IZKseVpdzPSBaWxBxundA","HYBE LABELS","10","21.02.04","BIGHIT|빅히트|방탄소년단|BTS|BANGTAN|방탄","1807593","342244","1216","21651","https://i.ytimg.com/vi/M3YdWaixPxY/default.jpg","False","False","HOSHI 'Spider' Official Teaser 1 #HOSHI #호시#Spider #스파이더#210402_6pm_KSTSEVENTEEN Official Homepage : http://www.seventeen-17.comSEVENTEEN Official Facebook : https://www.facebook.com/seventeennewsSEVENTEEN Official Twitter : https://twitter.com/pledis_17SEVENTEEN Official Instagram : http://www.instagram.com/saythename_17SEVENTEEN Official Fancafe : http://cafe.daum.net/pledis-17SEVENTEEN Official Weverse : https://www.weverse.io/seventeenⓒ Pledis Entertainment. All Rights Reserved"
"4Z6gkWW8gDU","[꼬꼬무2 3회 요약] 평양으로 가! 납치된 비행기를 김포공항에 무조건 착륙시켜야 한다! 방송 최초 당시 관제사의 인터뷰 공개 | 꼬리에 꼬리를 무는 그날 이야기 (SBS방송)","2021-03-26T09:00:01Z","UCPx-7AKiN1Z_qEVKhLQ5pAw","달리 [SBS 교양 공식채널]","24","21.02.04","꼬꼬무|꼬꼬무2|꼬꼬무요약|요도호사건|꼬꼬무요도호|요도호납치사건|요도호|JAL기|JAL351편|공중납치|비행기납치|Kal기납북|박정희|하이재킹|적군파|하네다국제공항|후쿠오카공항|김포국제공항|707특임대|꼬꼬무다시보기|꼬꼬무시즌2|꼬꼬무2요약|꼬꼬무시즌|꼬리에꼬리를무는그날이야기|꼬꼬그|재희석|비행기규정|장트리오|장성규|장항준|장도연|SBS꼬꼬무|박재범","629111","6029","243","906","https://i.ytimg.com/vi/4Z6gkWW8gDU/default.jpg","False","False","#꼬꼬무2 #꼬꼬무요약 #요도호납치사건만우절을 하루 앞둔 1970년 3월 31일, 거짓말 같은 사건이 벌어졌다.오전 7시 10분 도쿄 하네다 공항. 후쿠오카 행을 위해 이륙한 일본 국내선 비행기 요도호에는 유일한 한국인 승객 김원동 씨가 탑승해있었다. 이른 아침부터 공항에 오느라 피곤했던 김원동 씨가 잠에 빠져든 그때...“모두 움직이지 마!! 양손 머리 위로 올려!!”갑작스러운 소음에 잠이 깬 김원동 씨의 눈앞에는 믿지 못할 풍경이 펼쳐져 있었다. 총과 칼로 무장한 괴한들이 승객들을 위협하고 있었던 것이다. 비행기는 순식간에 아수라장이 되어버렸다. 잠시 후, 일본 영공을 벗어난 요도호는 한국 영공으로 진입하게 되는데...“위-잉“그 시각, 김포공항에 주둔한 미군 부대에서는 요란한 사이렌 소리가 울려 퍼졌다. 갑작스러운 비상사태에 긴장감이 감도는 레이더 진입 관제소! 대통령도 함부로 들어오지 못한다는 그곳에 한 남자가 들어선다. 그리고 그에게 전해진 비밀스러운 임무.“그 비행기를 무조건 김포공항에 착륙시키게.”아무런 설명과 정보 없이 요도호 탑승객 138명의 운명을 책임지게 된 이 남자! 정부 기밀문서에도 기록되지 않은 ‘그’의 정체는 무엇일까? 일본 열도에서 시작해 동북아시아를 발칵 뒤집은 사상 초유의 ‘그날 이야기’. 51년간 베일에 싸여있던 ‘그’의 생생한 증언을 한국 방송 최초로 공개한다.장도연, 장성규, 장항준, 세 이야기꾼이 전하는꼬리에 꼬리를 무는 그날 이야기2 3회 우리들은 ‘내일의 조’ : 사상초유 더블하이재킹 (2021.03.25 방송)[꼬리에 꼬리를 무는 그날 이야기2] 풀영상 다시보기▶ 꼬꼬무 홈페이지 : https://programs.sbs.co.kr/culture/2021tail/main▶ 웨이브(wavve) : https://www.wavve.com/​"
"BOUolhHEkH8","[전지적 참견 시점 선공개] 먹벤져스의 등장?! 홍현희 X 천뚱 X 유민상의 삼겹살 먹방♨, MBC 210327 방송","2021-03-27T01:00:01Z","UCiBr0bK06imaMbLc8sAEz0A","MBCentertainment","24","21.02.04","MBC|예능|토요예능|전지적참견시점|전지적|참견시점|전참시|관찰예능|먹방|눕방|맛집|여행|매니저|제보|리얼|예고|Preview|이영자|전현무|송은이|양세형|유병재|LeeYoungja|JunHyunmoo|SongEun-i|YangSehyung|YuByeongjae","1211572","5198","301","593","https://i.ytimg.com/vi/BOUolhHEkH8/default.jpg","False","False","[전지적 참견 시점] 토요일 밤 11시 10분 방송!먹벤져스의 등장?! 홍현희 X 천뚱 X 유민상의 삼겹살 먹방♨★★★More clips are available★★★iMBChttp://www.imbc.com/broad/tv/ent/omniscient/vod/index.htmlWAVVEhttps://www.wavve.com/player/vod?programid=M_1003594100000100000&page=1"
"Pex91Jzk82I","[아내에게하는 골프레슨 081] 던지는 스윙을 위한 단계별 접근방법","2021-03-27T23:00:04Z","UCZSNhOLPx3q87ss_N-vsmSA","[골프맨]조윤성프로","17","21.02.04","골프|골프레슨|golf|golf lesson|드라이버|아이언|골프맨|조윤성프로|골프스윙|비거리|장타|골프기초|투플래인|몸통스윙|컨벤셔널|조윤성|아내에게하는 골프레슨|부부골프|백스윙|다운스윙|임팩트|팔로우스루|던지기|힙턴|지면반력|정타|골프기본기|골프프로|호주골프|숏게임|어프로치|드라이버정타|다운블로|피니쉬|Golf backswing|Golf impact|Driver|Iron|프로골퍼|스윙스피드|골프강좌|PGA|골프유튜브|힌징|코킹|허리턴|골프라운드|드로우|페이드|퍼팅|칩샷|피치샷","236832","2706","49","165","https://i.ytimg.com/vi/Pex91Jzk82I/default.jpg","False","False","조윤성프로 (호주PGA)Email: davidcho@pgamember.org.auInstagram: https://www.instagram.com/davidyoonseong/?hl=enFacebook: https://www.facebook.com/davidyoonseong.cho/#골프 #골프레슨 #golf"
"J_sPEzOsixE","(ENG) 나 엑소 좋아했네? 솔직히 여기 나온 노래 모르는 사람 대한민국 국민 아님(그만큼 명곡이 많다는 뜻) / [문명특급 EP.177]","2021-03-25T08:02:09Z","UCUyfkq9e9ZfPzxOW5WQ9rzQ","문명특급 - MMTG","24","21.02.04","문명특급|스브스뉴스|재재|SBS|문특|mmtg|엑소|exo|백현|baekhyun|으르렁|늑대와미녀|수호|찬열|카이|디오|세훈|시우민|첸|레이|첸백시|suho|chanyeol|kai|d.o.|sehun|xiumin|chen|lay|exo-k|exo-l|exo-m|밤비|bambi|mama|마마|sm|에스엠|이수만|변백현|백현이씨|천재아이돌|스포장인|김준면|김민석|도경수|김종인|오세훈|카스썰|중독|overdose|love me right|재컴백|call me baby|love shot|럽미라잇|러브샷|코코밥|몬스터|exo-cbx|엑소 콘서트|밀리언셀러|candy|유엔빌리지|un village|큥튜브|큥이|앙글","1904109","95647","897","8705","https://i.ytimg.com/vi/J_sPEzOsixE/default.jpg","False","False","2030의 나훈아 엑소 백현이 왔읍니다👏👏👏큥이 언제 서른 살 됐어ㅠ 나만 늙었어 나만ㅠSM 전직원의 투표를 뒤로 하고 이수만 쌤이 혼자 골랐다는엑소의 명곡은 과연 어떤 노래였을까요?#백현 #밤비 #엑소 #EXO #BAEKHYUN #Bambi기획/하현종  프로듀서/이아리따  진행/이은재  구성/이은재 이규희 이세정  촬영/오채영 최송인  디자인·CG/김하경 김한솔  담당인턴/김은비 이수현  마케팅/남승훈 김유진 정아름  조연출·편집/오한주  연출/홍민지  제작/SBS디지털뉴스랩 크리에이티브 사업부문"
"DvaqF6Kvjpc","김성규(Kim Sung Kyu) 'HUSH' MV","2021-03-29T09:00:04Z","UCoQIdt0bWPv3-_xuybJvTjQ","woolliment","24","21.02.04","[none]","268457","41813","95","4896","https://i.ytimg.com/vi/DvaqF6Kvjpc/default.jpg","False","False","If you like this video, plz click LIKE and SUBSCRIBE.김성규(Kim Sung Kyu) 'HUSH' MV2021.03.29 6PM RELEASE#인피니트​​​ #INFINITE​​​ #김성규​​​ #KIMSUNGKYU​​​ #WontForgetYou​​ #HUSH[ INFINITE Official ]Fancafe(팬카페) : http://cafe.daum.net/infinite7​​​YouTube(유튜브) : http://www.youtube.com/c/INFINITE6​​​Twitter(트위터) : http://twitter.com/Official_IFNT​​​Facebook(페이스북) : http://www.facebook.com/ifnt7​​​Instagram(인스타그램) : http://www.instagram.com/official_ifn...​WOOLLIM Entertainment Official Website : http://www.woolliment.com​"
"3JqKYyHW8L4","[인간극장 레전드 #103-1] 8년만에 만난 첫사랑과 사과농사짓기🍎 | 사과밭 첫사랑 (1/2) [KBS 20160926-0927 방송]","2021-03-27T00:00:14Z","UC6wiUwl7dPhZOAM92lGgKPg","KBS HUMAN: 뭉클티비","24","21.02.04","kbs|KBS 휴먼|뭉클티비|인간극장|인간극장 레전드|TV는 사랑을 싣고|TV는 사랑을 싣고 레전드|이웃집찰스|이웃집 찰스 레전드|체험 삶의 현장|체험 삶의 현장 레전드|kbs human|사과밭첫사랑|사랑|애정|큐티|부부|농사","650879","3438","216","274","https://i.ytimg.com/vi/3JqKYyHW8L4/default.jpg","False","False","#인간극장 #인간극장레전드 #사과밭첫사랑2016년 9월 26일~9월 30일 방송이번주 인간극장 레전드는 '사과밭 첫사랑' 편입니다.열다섯에 첫사랑에 빠진 보근 씨, 8년 전 퇴짜 맞았던 고백이 8년 후 결혼으로 돌아왔습니다. 이번이 2번째 수확인 초보 농부 부부는 오늘도 열심히 사과밭을 돌보고 있습니다.한편, 은혜 씨의 아버지는 자식들과 사위에게 저녁을 대접하고자 시내로 부릅니다. 즐겁게 밥을 먹고 있는 와중에 비가 내리기 시작하는데,,,3년차 신혼부부, 2년차 초보 농부이지만 성실히 알콩달콩 열매를 맺어가는 듯 싶습니다. 🍎🎬인간극장 레전드 정주행 링크🎬정만씨와 점순씨 https://youtu.be/fJ4kgLYi0L4비호네의 희망 질주 https://youtu.be/GW3xHK9kT0A충남 501호 병원선 사람들 https://youtu.be/8-zMlSP0JHo99세 동환 씨, 한 백 년 살다 보니 https://youtu.be/gDQa6nooQmg은반 위의 발레리나 박소연 https://youtu.be/c5uzRYVh9ns피아비의 꿈 https://youtu.be/_bKUCDn5_3E소녀와 톨스토이 https://youtu.be/cY5rO4o-ius백 년을 살아보니 - 철학자 김형석 https://youtu.be/bh2n6QNz2w8세 스님과 홍인이 https://youtu.be/gpHeq9xxOcI어머니의 그림 https://youtu.be/gTcUX-k6zIA미래야 학교 가자 https://youtu.be/olxmDftPse8푸른 하늘 은하수 https://youtu.be/H2X-bVSZUzs세 스님과 홍인이, 그 후 https://youtu.be/fGrE2FcEJZ8못 말리는 광일 씨, 맨땅에 귀농 https://youtu.be/zChwt4gdtWk그렇게 부모가 된다 https://youtu.be/5RogUxkQGss김 씨네 둘째 딸 한나 https://youtu.be/laj1dd_nA7Y오복식의 크리스마스 https://youtu.be/CWY4DAsF5Gc네쌍둥이가 태어났어요 https://youtu.be/PCkmHtOKuzE"
"6xz1bay-6dQ","[#하이라이트#]드디어 만남 성사! 진짜 BTS와 BTS 여고생의 만남! 살아계세요?#유퀴즈온더블럭 | YOU QUIZ ON THE BLOCK EP.99","2021-03-24T14:14:47Z","UC920m3pMPH45qztdhppZhwA","유 퀴즈 온 더 튜브","24","21.02.04","BTS|RM|방탄소년단|뷔|슈가|유재석|유퀴즈|유퀴즈온더블럭|정국|제이홉|조세호|지민|진","11281262","623879","4667","26780","https://i.ytimg.com/vi/6xz1bay-6dQ/default.jpg","False","False","유 퀴즈 온 더 블럭매주 (수) 저녁 8시 40분 tvN#유퀴즈온더블럭 #유퀴즈 #유재석 #조세호 #방탄소년단 #BTS #RM #진 #슈가 #제이홉 #지민 #뷔 #정국"
"buVi83WQHok","한국 유튜브 10초 요약","2021-03-26T11:07:13Z","UC7Krez5EI8pXKHnYWsE-zUw","소련여자 Soviet girl in Seoul","24","21.02.04","마피아시티|mafiacity|제딸을살해한놈들을|대한민국|근황|LH|돈버는법|외국인|러시아|현실판","2252299","50150","845","4755","https://i.ytimg.com/vi/buVi83WQHok/default.jpg","False","False","10초든 30초든 그게 무슨 상관인데?#shorts"
"aZpwFoV0TRQ","롤린 이어 운전만해도 킹주행! 쁘야호! 쁘걸등판! 준비됐나 제군들! | 브레이브걸스(Brave Girls)_롤린(Rollin’) | 본인등판 | Look Me Up","2021-03-26T08:00:14Z","UCqq-ovGE01ErlXakPihhKDA","1theK Originals - 원더케이 오리지널","24","21.02.04","본인등판|브레이브걸스|롤린|브레이브걸스 롤린|역주행|브레이브걸스 역주행|롤린 역주행|민영|유정|은지|유나|꼬북좌|단발좌|Brave Girls|Rollin’|브걸","794743","19533","160","2967","https://i.ytimg.com/vi/aZpwFoV0TRQ/default.jpg","False","False","롤린 이어 운전만해도 킹주행! 쁘야호! 쁘걸등판! 준비됐나 제군들! | 브레이브걸스(Brave Girls)_롤린(Rollin’) | 본인등판 | Look Me Up#브레이브걸스#롤린#본인등판#BraveGirls#Rollin#LookMeUp#New1theKOriginal#1theK#원더케이#원더케이오리지널롤린 이어 운전만해도 킹주행!쁘야호! 쁘걸등판! 준비됐나 제군들!용형 대표님! 그 샌드위치 저희가 안 먹었어요!그나저나 샤넬백은 언제 도착하나요?----------------------------------------------------------------------------K-POP Wonderland, 1theKK-POP의 모든 즐거움이 여기에,새롭게 바뀐 1theK 로고와 다양한 오리지널 컨텐츠를 만나보세요!----------------------------------------------------------------------------K-POP Wonderland, 1theKAll the joys of K-pop here!1theK has a wide variety of Original Content----------------------------------------------------------------------------▶1theK YT : https://www.youtube.com/1theK▶1theK FB  : http://www.facebook.com/1theK▶1theK TW : https://twitter.com/1theK▶1theK Kakao : https://goo.gl/otRpZc▶1theK TikTok : https://vt.tiktok.com/2mSMBS"
"e4AiiBkPCDk","[인간극장 레전드 #103-2] 동생을 도와주기 위해 모인 마음까지 아름다운 세 자매!💕 | 사과밭 첫사랑 (2/2) [KBS 20160928-0930 방송]","2021-03-28T00:00:12Z","UC6wiUwl7dPhZOAM92lGgKPg","KBS HUMAN: 뭉클티비","24","21.02.04","kbs|KBS 휴먼|뭉클티비|인간극장|인간극장 레전드|TV는 사랑을 싣고|TV는 사랑을 싣고 레전드|이웃집찰스|이웃집 찰스 레전드|체험 삶의 현장|체험 삶의 현장 레전드|kbs human|사과밭첫사랑|뭉클|감동|청년농부|부부|사과|농사","299730","1429","88","160","https://i.ytimg.com/vi/e4AiiBkPCDk/default.jpg","False","False","#인간극장 #인간극장레전드 #사과밭첫사랑2016년 9월 26일~9월 30일 방송이번주 인간극장 레전드는 '사과밭 첫사랑' 편입니다.1년 간 열심히 키운 사과를 열심히 따기 시작합니다. 💨혼자서는 절대 못한다는 시골 농사. 농사 막바지 청년 부부를 돕기 위해 사돈져스가 모였습니다. 더하여 자매들의 지원까지..!다시금 열매를 맺은 사과나무가 그들 앞에 기다리고 있습니다. 3년차 신혼부부, 2년차 초보 농부이지만 성실히 알콩달콩 열매를 맺어가는 듯 싶습니다. 🍎🎬인간극장 레전드 정주행 링크🎬정만씨와 점순씨 https://youtu.be/fJ4kgLYi0L4비호네의 희망 질주 https://youtu.be/GW3xHK9kT0A충남 501호 병원선 사람들 https://youtu.be/8-zMlSP0JHo99세 동환 씨, 한 백 년 살다 보니 https://youtu.be/gDQa6nooQmg은반 위의 발레리나 박소연 https://youtu.be/c5uzRYVh9ns피아비의 꿈 https://youtu.be/_bKUCDn5_3E소녀와 톨스토이 https://youtu.be/cY5rO4o-ius백 년을 살아보니 - 철학자 김형석 https://youtu.be/bh2n6QNz2w8세 스님과 홍인이 https://youtu.be/gpHeq9xxOcI어머니의 그림 https://youtu.be/gTcUX-k6zIA미래야 학교 가자 https://youtu.be/olxmDftPse8푸른 하늘 은하수 https://youtu.be/H2X-bVSZUzs세 스님과 홍인이, 그 후 https://youtu.be/fGrE2FcEJZ8못 말리는 광일 씨, 맨땅에 귀농 https://youtu.be/zChwt4gdtWk그렇게 부모가 된다 https://youtu.be/5RogUxkQGss김 씨네 둘째 딸 한나 https://youtu.be/laj1dd_nA7Y오복식의 크리스마스 https://youtu.be/CWY4DAsF5Gc네쌍둥이가 태어났어요 https://youtu.be/PCkmHtOKuzE"
"52_KJPh4Hrk","(Eng) 무개념 주차한 사람이 엄청난 훈남이라면?! 여자도 똑같을까?ㅋㅋ (걸깝스 장하나)","2021-03-27T04:00:01Z","UCV3i3lkhJEVB-OApwiBVpSA","깨방정","23","21.02.04","#깨방정|#정승빈|#몰카|#미녀|#개그맨|#존잘남|#존예녀|#디스코|#깨방정디스코|#깨방정댄스|#깨방정춤","624520","5764","526","625","https://i.ytimg.com/vi/52_KJPh4Hrk/default.jpg","False","False","#깨방정 #몰카 #정승빈#훈남 #존잘남 #몸짱 #피트니스모델 #박영호#재밌는영상 #웃긴영상 #몰래카메라 #prank #kprank #koreanprank"
"W9AVhk3lqeI","체리가 태어났어요 | 미국 의사도 놀라게 한 감동 출산 후기","2021-03-26T07:00:05Z","UCicKQUi8h4NI81wDmrDBD4A","올리버쌤","27","21.02.04","[none]","1972970","85302","426","17257","https://i.ytimg.com/vi/W9AVhk3lqeI/default.jpg","False","False","[올리버쌤의 영어회화 일력 365]저와 함께 새해 영어 공부를 매일 함께 해봐요!! 교보문고 https://bit.ly/389tTbX예스24 https://bit.ly/3l1nXFo알라딘 https://bit.ly/3etrwBP인터파크 https://bit.ly/3kYvHYY[해외에서 구매하고 싶다면?!]인터파크 글로벌 https://bit.ly/2Jfcc0J드디어 체리를 만나러 산부인과에 왔어요.그리고 세상에서 가장 감동적인 순간을 만났어요.여러분과 이 특별한 순간을 공유하게 되어서 정말 기쁩니다.세상 모든 어머니들과 아기들에게 존경의 마음을 보내요. [올리버쌤의 실전 영어 꿀팁 100] 구매하기 예스24 https://bit.ly/31o54Dg교보문고 https://bit.ly/2R7WlQZ[올리버쌤의 영어 꿀팁] 책 구매하기예스24 http://bit.ly/2QigDck교보문고 http://bit.ly/2qWTNJc[올리버쌤 인스타그램] http://instagram.com/oliverkorea [유기견 입양 신청 및 해외 이동봉사 문의]메일 2798catherine@gmail.com인스타 instagram.com/yellow_mom_"
"OHq3UxfthZQ","[더 수어사이드 스쿼드] 무삭제 1차 예고편","2021-03-28T01:00:01Z","UC8AD5KHdsFzp8qoJvS4YSYg","Warnerbros Korea","22","21.02.04","[none]","744021","5934","112","2072","https://i.ytimg.com/vi/OHq3UxfthZQ/default.jpg","False","False","나쁜 세상, 더 나쁜놈들! 죽이지 않으면 죽는다!#가디언즈오브갤럭시 #제임스건 감독의 [더 수어사이드 스쿼드]#더수어사이드스쿼드 #8월대개봉"
"Dzm2-CwNZRc","임형철 여잘알 만들기(feat.박종윤 선생님)","2021-03-27T08:30:14Z","UCnet0ISpaEA3oyteCLh73lA","이수날","22","21.02.04","이수날|정이수|경희대구너|경희대 구너|슛포러브|이스타|이스타TV|임형철|아다테타|임형철 해설위원|연애배치고사|모태솔로|모태쏠로|모쏠|박종윤|번개맨|이수타|이수타TV","173667","2849","40","845","https://i.ytimg.com/vi/Dzm2-CwNZRc/default.jpg","False","False","형철띠.. 제가 연애고수로 만들어 드릴게요..이수타TV 만만세-비즈니스 메일 : eesoonal.fc@gmail.com인스타그램 : http://www.instagram.com/eesoo_j"
"LdBSj1bJvWI","BAEKHYUN 백현 The 3rd Mini Album Bambi Sounds Room","2021-03-27T15:00:06Z","UCzCedBCSSltI1TFd3bKyN6g","EXO","10","21.02.04","EXO|엑소|엑소케이|엑소엠|exok|exom","1356717","334737","421","39534","https://i.ytimg.com/vi/LdBSj1bJvWI/default.jpg","False","False","BAEKHYUN's 3rd Mini Album Bambi is out!Listen and download on your favorite platform: https://smarturl.it/BAEKHYUN_BAMBI[Tracklist]01 Love Scene02 Bambi03 All I Got04 놀이공원 (Amusement Park)05 Privacy06 Cry For LoveBAEKHYUN Officialhttp://www.youtube.com/baekhyunhttp://www.youtube.com/weareoneEXOhttp://www.facebook.com/weareoneEXOhttp://www.instagram.com/weareone.exohttps://www.vlive.tv/channel/F94BDhttp://twitter.com/weareoneEXO#BAEKHYUN #백현 #Bambi #Sounds_RoomBAEKHYUN 백현 The 3rd Mini Album Bambi Sounds Room  ℗ SM Entertainment"
"FvXs6BLGgcI","밥 해야하는데... 비가오네... l 철원일기 3화","2021-03-28T11:00:04Z","UCIY5oUCeajc-RrQovJHBp1A","승우아빠 이상채널","24","21.02.04","승우아빠|철원|철원일기|승우아빠 철원일기","286694","4359","110","510","https://i.ytimg.com/vi/FvXs6BLGgcI/default.jpg","False","False","철모닝 (철원의 맥모닝 이라는 뜻)　　　　　　　　　　　　　　　　　　　　　　　　　　　　　　　　　　　　　　　　　　　　　　　　　　　　　　　　　　　　　　　　　　　　　　　　　　　　　　　　　　　　　　　#승우아빠​​ #철원일기 #아궁이요리​오늘은 비내리는 철원에서 아궁이로 요리해 봤습니다철모닝*오프닝 BGM - 리코더대가 주호민님https://www.youtube.com/channel/UCFsyeRb-ShbdPQ2azhd6-fg*엔딩 BGM - 멜로디훈님 https://www.youtube.com/user/melodyhoon전원일기 BGM 참여를 원하시는 분은 언제든 연락 주세요!swabevent@gmail.com✔️ 트위치 https://www.twitch.tv/swab85​​​✔️ 공식카페 https://cafe.naver.com/swab​​​📪 문의 seungwoodaddy@sandboxnetwork.net🎁  택배수령주소 : 서울시 용산구 서빙고로 17 센트럴파크타워, 30층 샌드박스 승우아빠냉장 보관이 불가능하기 때문에 식품류는 수령이 불가능합니다"
"rq2VRnyIAM0","[줌터뷰] 1년 만에 다시 만난 세븐틴(SEVENTEEN) 네 멤버의 역대급 텐션! 태풍방지 숙소 창문✖️짤 해명(?)과 원우가 직캠에서 혀앓이를 한 이유?","2021-03-28T05:00:30Z","UCVWr5QkOkYupX6fEELMNvuQ","CosmopolitanKorea","26","21.02.04","세븐틴|SEVENTEEN|SVT|정한|JEONGHAN|원우|WONWOO|디에잇|THE8|민규|MINGYU|윤정한|전원우|서명호|김민규|고잉세븐틴|고셉|세븐틴유튜브|세븐틴줌터뷰|세븐틴인터뷰|ひとりじゃない|히토리쟈나이|세븐틴코스모폴리탄|cosmopolitankorea","239678","33161","48","1762","https://i.ytimg.com/vi/rq2VRnyIAM0/default.jpg","False","False","#세븐틴 #SEVENTEEN #줌터뷰세봉이들, 여기 고잉세븐틴 아니고 줌터뷰인데요!미친텐션 X 대환장 티키타카가 난무한 #세븐틴(@saythename_17) #정한 #원우 #디에잇 #민규 의 줌터뷰를 공개합니다❕ 태풍방지 숙소 창문✖️짤 해명(?)과 원우의 혀앓이, 디에잇과 민규 아버지의 만남까지! 캐럿💎 들 광대 폭발하는 세븐틴 네 멤버의 줌터뷰 풀버전은 코스모폴리탄 유튜브 계정에서 확인하세요🤍Digital Editor 김지현Film 강민하, 남기찬Photographer 윤지용Stylist 정환욱Hair Artist 임정호/블로우Makeup Artist 김시진, 가연/블로우00:34 정한이의 레고 근황은?00:49 코스모폴리탄의 공식 '댕냥유닛' 원우와 민규가 고잉 매거진 작업을 하면서 가장 신경 쓴 부분은?01:19 디에잇의 최근 취미는?01:43 '윤지노' 정한이가 최근에 즐겨 듣는 힙합 노래는?02:03 민규가 시상식 공약으로 약속했던 반반머리는?02:17 원우가 요즘 손이 많이 가는 패션 아이템은?02:27 디에잇을 가장 행복하게 만드는 것은?02:44 태풍 방지 테이프를 붙여놓고 떼지 않은 세븐틴 숙소 창문의 근황은?03:04 이번 생일에 민규가 멤버들에게 받고 싶은 선물은?03:54 직캠 장인 원우, 요즘은 무대할 때 혀앓이 안하는지?04:39 디에잇이 최근에 만난 세븐틴 멤버들의 가족은?04:59 스페셜앨범 ; [Semicolon] 속 탐나는 유닛 노래는?05:22 세븐틴 네 멤버가 각자 자신을 사랑하는 방법은?05:51 캐럿들에게 마지막으로 한 마디씩 한다면?"
"FaMlVIBCqg4","머리 안자르고 물만 계속 뿌리기ㅋㅋㅋ","2021-03-27T10:45:01Z","UCzRDCwJdqSSRwI4BgojVkIw","핫소스","22","21.02.04","핫소스|웃긴영상|예능|유머|장난|몰래카메라|시트콤|보물섬|핫소스 김선응|핫소스 송형주|핫소스 시트콤|hidden cam|머리 안자르고 물만 계속 뿌리기ㅋㅋㅋ|핫소스 배말랭","1186742","15978","375","2081","https://i.ytimg.com/vi/FaMlVIBCqg4/default.jpg","False","False","#핫소스 #웃긴영상 #시트콤음뫄!핫소스!머리 안자르고 물만 계속 뿌리기ㅋㅋㅋ좋아요&구독&알람설정!인스타주소@apnalchangchangkimseoneung 김선응@hyoja94 송형주"
"P2_zPspJ7A4","[ENG] [뮤비해석] 아이유 팬들이 이번 앨범에 과몰입할 수밖에 없는 이유 🤦‍♀️ㅣ아이유 '라일락'ㅣIU ‘LILAC’ MV explained & theory","2021-03-26T23:22:53Z","UCfbn_7tdW97URJyy865cIdA","김일오 15KIM","10","21.02.04","김일오|15KIM|15|일오|뮤비해석|뮤직비디오해석|김일오뮤비해석|아이유 라일락 뮤비해석|아이유 라일락|아이유|아이유 뮤비해석","581988","13915","108","795","https://i.ytimg.com/vi/P2_zPspJ7A4/default.jpg","False","False","정규 5집 무한 반복 중 ,,*English subtitles are available :)Please click on CC button!00:00 기차 승강장과 티켓00:58 HILAC과 BYLAC의 의미01:49 3가지 배경03:06 액션씬의 비밀04:08 '좋은 날'과의 연관성05:17 '미아' 나무와 아이유의 일기장06:02 밀가루와 졸업식06:40 20대의 여정을 끝내다07:12 신나는 곡임에도 슬픈 이유08:29 앨범 속 소소한 이스터에그10:37 마무리━━━━━━━━━━━💛 문의 및 팬아트 : 15kim@sandbox.co.kr💛 노래추천과 일상 인스타 : @kimiro_ohttps://instagram.com/kimiro_o?igshid...💛 김일오 사서함 : 서울시 용산구 서빙고로 17 센트럴파크타워 30층 샌드박스 메일룸 (04387)💛BGMMilliwonkim https://youtu.be/KQco5kHvZsABuGuMi https://youtu.be/wnEqaQW8ZAU━━━━━━━━━━━#아이유 #라일락 #뮤비해석"
